{
  "format": "gravitas.observation-data-pack",
  "formatVersion": 1,
  "id": "tess-hd209458-one-transit",
  "version": "1.0.0",
  "title": "HD 209458: one TESS transit (sector 56)",
  "object": {
    "name": "HD 209458",
    "identifiers": [
      "TIC 420814525"
    ],
    "ra": 330.794887332661,
    "dec": 18.8843189579296,
    "frame": "ICRS, epoch J2000",
    "tessMagnitude": 7.12739992
  },
  "facility": {
    "observatory": "TESS",
    "instrument": "camera 1, CCD 2, 2-minute cadence",
    "pipeline": "SPOC spoc-5.0.96-20230729"
  },
  "dataType": "light-curve",
  "origin": "observed",
  "credit": "TESS, sector 56 (NASA; SPOC light curve from MAST)",
  "license": {
    "status": "public-domain",
    "statement": "NASA mission data, released through MAST without restriction on reuse. MAST asks that work using its data acknowledge the mission and the archive."
  },
  "retrieved": "2026-09-24",
  "time": {
    "scale": "TDB",
    "reference": "BTJD = BJD - 2457000",
    "unit": "d"
  },
  "columns": [
    {
      "name": "time",
      "unit": "d",
      "description": "bin centre: t0 + (index + 0.5) x binDays, in BTJD"
    },
    {
      "name": "flux",
      "unit": "",
      "description": "PDCSAP flux over its median"
    },
    {
      "name": "flux error",
      "unit": "",
      "uncertaintyOf": "flux",
      "description": "propagated PDCSAP error over the median, one sigma, per bin"
    }
  ],
  "masks": [
    {
      "column": "QUALITY",
      "rule": "any nonzero flag drops the cadence",
      "dropped": 1288
    },
    {
      "column": "TIME, PDCSAP_FLUX, PDCSAP_FLUX_ERR",
      "rule": "a cadence without a finite value in all three is dropped",
      "dropped": 0
    },
    {
      "column": "bin",
      "rule": "a bin with fewer than 3 kept cadences is dropped",
      "dropped": 3
    },
    {
      "column": "bin",
      "rule": "outside 0.2 d of the chosen mid-transit",
      "dropped": 1853
    }
  ],
  "reductions": [
    "20-minute bins average 10 two-minute cadences each, which rounds ingress and egress to a bin.",
    "Flux is kept to 1 ppm and its error to 5 ppm.",
    "One transit of the seven in the sector."
  ],
  "source": {
    "archive": "MAST (Barbara A. Mikulski Archive for Space Telescopes)",
    "urls": [
      "https://mast.stsci.edu/api/v0.1/Download/file?uri=mast:TESS/product/tess2022244194134-s0056-0000000420814525-0243-s_lc.fits"
    ],
    "citations": [
      {
        "text": "TESS Light Curves - All Sectors, STScI/MAST",
        "doi": "10.17909/t9-nmc8-f686"
      },
      {
        "text": "Ricker et al. 2015, JATIS 1, 014003 (TESS)",
        "doi": "10.1117/1.JATIS.1.1.014003"
      },
      {
        "text": "Jenkins et al. 2016, Proc. SPIE 9913, 99133E (SPOC)",
        "doi": "10.1117/12.2233418"
      }
    ]
  },
  "raw": [
    {
      "file": "js/data/observations/tessHd209458S56.js",
      "url": "https://github.com/gravitas-sim/gravitas-sim.github.io/blob/v2/js/data/observations/tessHd209458S56.js",
      "bytes": 11063,
      "sha256": "1a5b2462c48762357cd7eb3988418078b07529a26cb726352d46627c9040f601"
    }
  ],
  "derived": {
    "file": "series.json",
    "bytes": 2641,
    "sha256": "3469bc3c125bebcdbe53d67f6f88aeb4ca353124c498ae66ecd304beebd4ce04"
  },
  "transformation": {
    "script": "build.mjs",
    "version": "1.0.0",
    "steps": [
      "Read the installed pack tess-hd209458-s56-lc through the SDK's installedDataPack(), pinned by its derived checksum.",
      "Fold on 3.52474859 d and take the deepest of 200 phase slots as mid-transit.",
      "Keep the bins within 0.2 d of the first mid-transit whose window has every bin: bins 96 to 124.",
      "Copy those bins exactly as encoded - the same t0, bin width, int16 ppm flux and error steps."
    ]
  },
  "assumptions": [
    "PDCSAP flux has had instrumental systematics and crowding removed by SPOC; that correction is used as published.",
    "Times are barycentric dynamical time for the target, as SPOC corrects them."
  ],
  "validation": {
    "check": "folding on the published period finds a transit of the published depth, within 0.003",
    "against": [
      {
        "quantity": "period",
        "value": 3.52474859,
        "unit": "d",
        "ref": "Knutson et al. 2007, ApJ 655, 564"
      },
      {
        "quantity": "(Rp/Rs)^2",
        "value": 0.0146,
        "unit": "",
        "ref": "Torres et al. 2008, ApJ 677, 1324 (Rp/Rs = 0.12086)"
      }
    ],
    "rule": {
      "kind": "folded-depth",
      "periodDays": 3.52474859,
      "expected": 0.0146,
      "tolerance": 0.003
    }
  },
  "compatible": {
    "widgets": [],
    "investigations": []
  },
  "offline": "optional"
}
