{
  "format": "gravitas.observation-data-pack",
  "formatVersion": 1,
  "id": "ngc3198-synthetic-curve",
  "version": "1.0.0",
  "title": "NGC 3198: a synthetic rotation curve",
  "object": {
    "name": "NGC 3198",
    "identifiers": [
      "NGC 3198"
    ]
  },
  "facility": {
    "observatory": "none: synthetic, made by Gravitas",
    "pipeline": "js/darkMatter.js galaxyCurveAt, with written-out scatter"
  },
  "dataType": "rotation-curve",
  "origin": "synthetic",
  "credit": "Synthetic: built by Gravitas to resemble NGC 3198 (van Albada et al. 1985). Not a measurement.",
  "license": {
    "status": "cc-by-4.0",
    "statement": "Gravitas’s own synthetic data, licensed as its teaching material is (CC BY 4.0, LICENSES.md)."
  },
  "retrieved": "2026-10-01",
  "columns": [
    {
      "name": "radius",
      "unit": "kpc",
      "description": "from the center"
    },
    {
      "name": "circular speed",
      "unit": "km/s",
      "description": "the model’s, plus the written-out offset"
    },
    {
      "name": "speed error",
      "unit": "km/s",
      "uncertaintyOf": "circular speed",
      "description": "one sigma, chosen: it grows outward as a real one does"
    }
  ],
  "masks": [],
  "reductions": [],
  "model": {
    "name": "bulge + Freeman exponential disc + pseudo-isothermal halo (js/darkMatter.js galaxyCurveAt)",
    "parameters": {
      "bulgeMass": 500000000,
      "discMass": 33000000000,
      "discScale": 2.6,
      "haloVFlat": 150,
      "haloCore": 6
    },
    "scatter": "fixed offsets of -3 to +3 km/s, written out one per point; error bars of 3 to 7 km/s growing outward",
    "resembles": "NGC 3198 as van Albada et al. (1985) describe it: a 2.68 kpc disc scale length (2.6 here), a curve flat near 150 km/s, measured to 30 kpc",
    "chosen": "the bulge mass, the disc mass and the halo core radius are this model’s own choices, not the paper’s"
  },
  "source": {
    "archive": "none: generated by Gravitas",
    "urls": [
      "https://articles.adsabs.harvard.edu/pdf/1985ApJ...295..305V"
    ],
    "citations": [
      {
        "text": "van Albada, Bahcall, Begeman & Sancisi 1985, ApJ 295, 305 (the galaxy the model is built to resemble)",
        "doi": "10.1086/163375"
      },
      {
        "text": "Freeman 1970, ApJ 160, 811 (the exponential disc)",
        "doi": "10.1086/150474"
      },
      {
        "text": "de Blok et al. 2008, AJ 136, 2648 (THINGS: a published NGC 3198 curve, not used here)",
        "doi": "10.1088/0004-6256/136/6/2648"
      }
    ],
    "checked": "van Albada et al. (1985), read in the scan ADS serves (2026-10-01): the abstract’s rotation curve “that extends to 11 disk scale lengths” with its “last point … at 30 kpc”, the disc scale length of 60 arcsec = 2.68 kpc for H0 = 75, and table 2’s velocities of 146 to 157 km/s from 2 to 11 arcmin."
  },
  "raw": [],
  "transformation": {
    "script": "tools/data-packs/ngc3198-synthetic.mjs",
    "version": "1.0.0",
    "options": {},
    "steps": [
      "Evaluate the model’s circular speed (js/darkMatter.js galaxyCurveAt) at each radius.",
      "Add the written-out offset, and attach the written-out error bar."
    ]
  },
  "assumptions": [
    "These points are not a measurement of NGC 3198 or of any galaxy, and nothing that shows them may say they are.",
    "The model resembles NGC 3198 in its disc scale length, its flat speed and its extent, and in nothing else."
  ],
  "compatible": {
    "widgets": [
      "dm-fit",
      "dm-mond"
    ],
    "investigations": [
      "missing-mass"
    ]
  },
  "offline": "core",
  "derived": {
    "file": "js/data/ngc3198Synthetic.js",
    "bytes": 3904,
    "sha256": "0d40d672aa86a3608f525aa818216fafc2d9382ebb8e90063b50aa9fc0f81d66"
  },
  "validation": {
    "check": "the generating model fits the points to within their mean error bar, the same disc with no halo misses them by more than five error bars, and the curve reaches 30 kpc",
    "against": [
      {
        "quantity": "last point of the curve",
        "value": 30,
        "unit": "kpc",
        "ref": "van Albada et al. 1985, ApJ 295, 305, abstract"
      }
    ],
    "result": {
      "rmsWithHaloKms": 2.06,
      "rmsStarsOnlyKms": 41.95,
      "meanErrorKms": 4.67,
      "lastRadiusKpc": 30
    }
  }
}
